{
  "schemaVersion": 1,
  "id": "retail-chains",
  "status": "published",
  "title": "连锁零售门店资料统一分发",
  "summary": "让总部资料快速、受控地下发到全国门店，门店也能及时上传报表与反馈，信息传递更规范、更高效。",
  "updatedAt": "2026-08-08",
  "cover": {"src": "media/yiliyun/hero.png", "alt": "连锁零售品牌通过企业网盘向门店分发资料并收集反馈"},
  "customer": "某全国连锁餐饮品牌",
  "challenge": "总部需要定期向数百家门店下发菜单、营销物料与操作规范，过去依赖邮件和社交工具，版本不一致、接收情况难掌握，门店反馈也难以统一回收。",
  "solution": "为总部与门店建立共享空间，用受控外链下发最新物料并设置有效期；门店按统一目录上传经营报表，总部通过最近使用与更新记录掌握下发与反馈情况。",
  "results": [
    "门店物料版本一致，不再出现新旧混用",
    "下发与反馈链路清晰，信息传递效率提升",
    "外部渠道资料通过受控外链分发，边界可控"
  ],
  "productIds": ["yiliyun-drive", "yiliyun-share", "yiliyun-team"],
  "seo": {
    "title": "连锁零售门店资料分发案例 | 一粒云",
    "description": "了解一粒云如何帮助连锁品牌统一分发门店资料并回收反馈。",
    "keywords": ["连锁零售", "门店管理", "资料分发", "安全外链", "一粒云"],
    "image": "media/yiliyun/hero.png"
  }
}
