{
  "schemaVersion": 1,
  "id": "manufacturing-rd",
  "status": "published",
  "title": "制造企业研发资料统一管理",
  "summary": "把分散在个人电脑与聊天工具中的图纸、规格与项目文档收敛到统一企业网盘，让研发资料集中、可控、可追溯。",
  "updatedAt": "2026-08-10",
  "cover": {"src": "media/yiliyun/hero.png", "alt": "制造企业研发部门在统一企业网盘中管理图纸与项目文档"},
  "customer": "长三角某智能装备制造集团",
  "challenge": "研发部门每天产生大量图纸、规格书与项目文档，长期散落在个人电脑和微信传输中。人员变动时资料容易丢失，多版本并存导致协作混乱，部分关键图纸的访问权限也无法控制。",
  "solution": "为研发、工艺与质量等团队建立企业网盘空间，按项目建立共享目录并统一归档；对关键图纸设置严格的下载与外发权限，同时开启版本管理，让每次更新都可回溯。",
  "results": [
    "图纸与项目文档实现集中管理，查找时间明显缩短",
    "跨版本协作不再依赖个人命名，版本脉络清晰",
    "关键图纸的访问与下载权限全程可控、可审计"
  ],
  "productIds": ["yiliyun-drive", "yiliyun-permission", "yiliyun-version"],
  "seo": {
    "title": "制造企业研发资料统一管理案例 | 一粒云",
    "description": "了解一粒云如何帮助制造企业把研发资料集中管理、可控可追溯。",
    "keywords": ["制造企业", "研发资料", "企业网盘", "版本管理", "一粒云"],
    "image": "media/yiliyun/hero.png"
  }
}
